{
  "schema_version": 1,
  "host_profile": "development-workstation",
  "principal_attestation": {
    "schema_version": 1,
    "principal_id": "engineering.runtime.primary",
    "adapter_id": "codex",
    "verified": true,
    "issued_at": "2026-10-01T08:00:00Z",
    "session_id": "fixture-engineering-session",
    "evidence_ref": "fixture://trusted-launcher/engineering.runtime.primary"
  },
  "role": "engineer",
  "declared_risk": "R2",
  "created_at": "2026-10-01T08:00:00Z",
  "expires_at": "2099-01-01T00:00:00Z",
  "workspace": {
    "path": ".",
    "branch": "feat/behavioral-eval-framework",
    "head": "6a847ab000000000000000000000000000000000",
    "dirty": false,
    "dirty_fingerprint": "sha256:0000000000000000000000000000000000000000000000000000000000000000"
  },
  "work_package_ref": "WP-fixture",
  "acceptance_ref": null,
  "approval": null,
  "host": {
    "tool_available": true,
    "permission_state": "ALLOW"
  }
}